[
  {
    "Id": "mirae-python-rich-v1",
    "Title": "Python · Kod natijasi va mantiq",
    "ClassName": "IT-1",
    "Subject": "Informatika",
    "TimeLimitMinutes": 20,
    "ShowReviewAfterFinish": true,
    "Questions": [
      {
        "Text": "Kod bajarilganda ekranga qaysi natija chiqadi?",
        "TextHtml": "<p>Kod bajarilganda <strong>ekranga qaysi natija</strong> chiqadi?</p><p>range funksiyasining oxirgi chegarasiga e’tibor bering.</p>",
        "Code": "total = 0\nfor n in range(1, 5):\n    total += n\nprint(total)",
        "Language": "python",
        "Topic": "For sikli",
        "Difficulty": "O‘rta",
        "Options": ["10", "15", "4", "5"],
        "CorrectIndex": 0,
        "Explanation": "range(1, 5) 1, 2, 3, 4 sonlarini beradi. Ularning yig‘indisi 10."
      },
      {
        "Text": "x = 3 bo‘lsa, x kvadrati + 2x + 1 ning qiymatini toping.",
        "Latex": "x^2 + 2x + 1,\\qquad x=3",
        "Topic": "Ifodalar",
        "Difficulty": "Oson",
        "Options": ["9", "12", "16", "18"],
        "CorrectIndex": 2,
        "Explanation": "3² + 2·3 + 1 = 9 + 6 + 1 = 16."
      },
      {
        "Text": "Quyidagi ro‘yxatning 1-indeksidagi qiymatni toping: [7, 12, 20].",
        "TextHtml": "<p>Ro‘yxatning <b>1-indeksidagi</b> qiymatini toping.</p><table><tr><th>Indeks</th><th>Qiymat</th></tr><tr><td>0</td><td>7</td></tr><tr><td>1</td><td>12</td></tr><tr><td>2</td><td>20</td></tr></table>",
        "Options": ["7", "12", "20"],
        "CorrectIndex": 1,
        "Explanation": "Python ro‘yxat indekslari 0 dan boshlanadi. 1-indeksdagi qiymat — 12."
      }
    ]
  }
]
